"speaker","date","title","url","country","conflict"
"Bill Clinton","September 28, 1999","Press Briefing by Joe Lockhart","https://www.presidency.ucsb.edu/documents/press-briefing-joe-lockhart-132","USA","Chechnya"
"Bill Clinton","October 22, 1999","Press Briefing by Joe Lockhart","https://www.presidency.ucsb.edu/documents/press-briefing-joe-lockhart-214","USA","Chechnya"
"Bill Clinton","October 28, 1999","The President's News Conference With President Olusegun Obasanjo of Nigeria","https://www.presidency.ucsb.edu/documents/the-presidents-news-conference-with-president-olusegun-obasanjo-nigeria","USA","Chechnya"
"Bill Clinton","November 01, 1999","Remarks Following Discussions With Prime Minister Kjell Magne Bondevik of Norway and an Exchange With Reporters in Oslo","https://www.presidency.ucsb.edu/documents/remarks-following-discussions-with-prime-minister-kjell-magne-bondevik-norway-and-exchange","USA","Chechnya"
"Bill Clinton","November 01, 1999","Press Briefing by Joe Lockhart","https://www.presidency.ucsb.edu/documents/press-briefing-joe-lockhart-120","USA","Chechnya"
"Bill Clinton","November 08, 1999","Remarks at Georgetown University","https://www.presidency.ucsb.edu/documents/remarks-georgetown-university-0","USA","Chechnya"
"Bill Clinton","November 08, 1999","Press Briefing by Joe Lockhart","https://www.presidency.ucsb.edu/documents/press-briefing-joe-lockhart-119","USA","Chechnya"
"Bill Clinton","November 09, 1999","Remarks on Budget Negotiations and an Exchange With Reporters","https://www.presidency.ucsb.edu/documents/remarks-budget-negotiations-and-exchange-with-reporters-0","USA","Chechnya"
"Bill Clinton","November 12, 1999","Press Briefing by National Security Advisor Sandy Berger, Assistant Secretary of State for European Affairs Mark Grossman, and Special Assistant to the President At N.S.C. Chris Hill on the President's Trip to Europe","https://www.presidency.ucsb.edu/documents/press-briefing-national-security-advisor-sandy-berger-assistant-secretary-state-for","USA","Chechnya"
"Bill Clinton","November 12, 1999","Press Briefing by Joe Lockhart","https://www.presidency.ucsb.edu/documents/press-briefing-joe-lockhart-117","USA","Chechnya"
"Bill Clinton","November 15, 1999","Remarks Following Discussions With President Suleyman Demirel of Turkey and an Exchange With Reporters in Ankara","https://www.presidency.ucsb.edu/documents/remarks-following-discussions-with-president-suleyman-demirel-turkey-and-exchange-with","USA","Chechnya"
"Bill Clinton","November 15, 1999","Press Briefing by National Security Advisor Sandy Berger","https://www.presidency.ucsb.edu/documents/press-briefing-national-security-advisor-sandy-berger-13","USA","Chechnya"
"Bill Clinton","November 17, 1999","Press Briefing by White House Press Secretary Joe Lockhart","https://www.presidency.ucsb.edu/documents/press-briefing-white-house-press-secretary-joe-lockhart","USA","Chechnya"
"Bill Clinton","November 18, 1999","Remarks at the Opening of the Organization for Security and Cooperation in Europe Summit in Istanbul","https://www.presidency.ucsb.edu/documents/remarks-the-opening-the-organization-for-security-and-cooperation-europe-summit-istanbul","USA","Chechnya"
"Bill Clinton","November 18, 1999","Remarks on the Budget Agreement and an Exchange With Reporters in Istanbul","https://www.presidency.ucsb.edu/documents/remarks-the-budget-agreement-and-exchange-with-reporters-istanbul","USA","Chechnya"
"Bill Clinton","November 18, 1999","Press Briefing by Secretary of State Madeleine Albright","https://www.presidency.ucsb.edu/documents/press-briefing-secretary-state-madeleine-albright-2","USA","Chechnya"
"Bill Clinton","November 18, 1999","Press Briefing by National Security Advisor Sandy Berger","https://www.presidency.ucsb.edu/documents/press-briefing-national-security-advisor-sandy-berger-12","USA","Chechnya"
"Bill Clinton","November 19, 1999","Remarks Prior to Discussions With Prime Minister Bertie Ahern of Ireland and an Exchange With Reporters in Istanbul","https://www.presidency.ucsb.edu/documents/remarks-prior-discussions-with-prime-minister-bertie-ahern-ireland-and-exchange-with","USA","Chechnya"
"Bill Clinton","November 20, 1999","The President's News Conference With Prime Minister Konstandinos Simitis of Greece in Athens","https://www.presidency.ucsb.edu/documents/the-presidents-news-conference-with-prime-minister-konstandinos-simitis-greece-athens","USA","Chechnya"
"Bill Clinton","November 22, 1999","Exchange With Reporters Prior to Discussions With President Petar Stoyanov of Bulgaria in Sofia","https://www.presidency.ucsb.edu/documents/exchange-with-reporters-prior-discussions-with-president-petar-stoyanov-bulgaria-sofia","USA","Chechnya"
"Bill Clinton","November 24, 1999","Remarks at the Thanksgiving Turkey Presentation Ceremony and an Exchange With Reporters","https://www.presidency.ucsb.edu/documents/remarks-the-thanksgiving-turkey-presentation-ceremony-and-exchange-with-reporters","USA","Chechnya"
"Bill Clinton","December 06, 1999","Remarks on Presenting the Eleanor Roosevelt Award for Human Rights","https://www.presidency.ucsb.edu/documents/remarks-presenting-the-eleanor-roosevelt-award-for-human-rights","USA","Chechnya"
"Bill Clinton","December 07, 1999","Press Briefing by Joe Lockhart","https://www.presidency.ucsb.edu/documents/press-briefing-joe-lockhart-112","USA","Chechnya"
"Bill Clinton","December 08, 1999","The President's News Conference","https://www.presidency.ucsb.edu/documents/the-presidents-news-conference-1060","USA","Chechnya"
"Bill Clinton","December 09, 1999","Remarks on the Digital Divide and an Exchange With Reporters","https://www.presidency.ucsb.edu/documents/remarks-the-digital-divide-and-exchange-with-reporters","USA","Chechnya"
"Bill Clinton","December 16, 1999","Press Briefing by Joe Lockhart","https://www.presidency.ucsb.edu/documents/press-briefing-joe-lockhart-109","USA","Chechnya"
"Bill Clinton","December 16, 1999","Press Briefing by Secretary of State Madeleine Albright","https://www.presidency.ucsb.edu/documents/press-briefing-secretary-state-madeleine-albright-3","USA","Chechnya"
"Bill Clinton","December 17, 1999","United States-European Union Summit Statement on Chechnya","https://www.presidency.ucsb.edu/documents/united-states-european-union-summit-statement-chechnya","USA","Chechnya"
"Bill Clinton","December 17, 1999","Press Briefing by Joe Lockhart","https://www.presidency.ucsb.edu/documents/press-briefing-joe-lockhart-211","USA","Chechnya"
"Bill Clinton","December 17, 1999","Press Briefing by Senior Director for European Affairs Tony Blinken","https://www.presidency.ucsb.edu/documents/press-briefing-senior-director-for-european-affairs-tony-blinken","USA","Chechnya"
"Bill Clinton","December 20, 1999","Press Briefing by Joe Lockhart","https://www.presidency.ucsb.edu/documents/press-briefing-joe-lockhart-210","USA","Chechnya"
"Bill Clinton","December 21, 1999","Press Briefing by Joe Lockhart","https://www.presidency.ucsb.edu/documents/press-briefing-joe-lockhart-108","USA","Chechnya"
"Bill Clinton","December 31, 1999","Statement on the Resignation of President Boris Yeltsin of Russia","https://www.presidency.ucsb.edu/documents/statement-the-resignation-president-boris-yeltsin-russia","USA","Chechnya"
"Bill Clinton","January 03, 2000","Press Briefing by Joe Lockhart","https://www.presidency.ucsb.edu/documents/press-briefing-joe-lockhart-87","USA","Chechnya"
"Bill Clinton","January 14, 2000","Press Briefing by Joe Lockhart","https://www.presidency.ucsb.edu/documents/press-briefing-joe-lockhart-67","USA","Chechnya"
"Bill Clinton","January 27, 2000","Press Briefing by Chief of Staff John Podesta, Deputy Chief of Staff Maria Echaveste, National Economic Advisor Gene Sperling, National Domestic Policy Advisor Bruce Reed, and National Security Advisor Sandy Berger on the President's State of the Union Address","https://www.presidency.ucsb.edu/documents/press-briefing-chief-staff-john-podesta-deputy-chief-staff-maria-echaveste-national","USA","Chechnya"
"Bill Clinton","January 27, 2000","Address Before a Joint Session of the Congress on the State of the Union","https://www.presidency.ucsb.edu/documents/address-before-joint-session-the-congress-the-state-the-union-7","USA","Chechnya"
"Bill Clinton","January 29, 2000","Remarks to the World Economic Forum and a Question-and-Answer Session in Davos, Switzerland","https://www.presidency.ucsb.edu/documents/remarks-the-world-economic-forum-and-question-and-answer-session-davos-switzerland","USA","Chechnya"
"Bill Clinton","February 14, 2000","Interview With Wolf Blitzer on CNN.com","https://www.presidency.ucsb.edu/documents/interview-with-wolf-blitzer-cnncom","USA","Chechnya"
"Bill Clinton","February 17, 2000","Press Briefing by Jake Siewert and David Leavy","https://www.presidency.ucsb.edu/documents/press-briefing-jake-siewert-and-david-leavy","USA","Chechnya"
"Bill Clinton","February 25, 2000","Remarks on Funding for Native American Programs and an Exchange With Reporters","https://www.presidency.ucsb.edu/documents/remarks-funding-for-native-american-programs-and-exchange-with-reporters","USA","Chechnya"
"Bill Clinton","February 25, 2000","Press Briefing by Joe Lockhart","https://www.presidency.ucsb.edu/documents/press-briefing-joe-lockhart-15","USA","Chechnya"
"Bill Clinton","February 29, 2000","Remarks at a Democratic National Committee Luncheon in West Palm Beach, Florida","https://www.presidency.ucsb.edu/documents/remarks-democratic-national-committee-luncheon-west-palm-beach-florida","USA","Chechnya"
"Bill Clinton","March 10, 2000","Press Briefing by Joe Lockhart","https://www.presidency.ucsb.edu/documents/press-briefing-joe-lockhart-9","USA","Chechnya"
"Bill Clinton","March 27, 2000","Statement on the Election of Vladimir Putin as President of Russia","https://www.presidency.ucsb.edu/documents/statement-the-election-vladimir-putin-president-russia","USA","Chechnya"
"Bill Clinton","May 03, 2000","Statement on World Press Freedom Day","https://www.presidency.ucsb.edu/documents/statement-world-press-freedom-day-0","USA","Chechnya"
"Bill Clinton","May 25, 2000","Press Briefing by National Security Advisor Samuel Berger and National Economic Advisor Gene Sperling","https://www.presidency.ucsb.edu/documents/press-briefing-national-security-advisor-samuel-berger-and-national-economic-advisor-gene","USA","Chechnya"
"Bill Clinton","May 31, 2000","The President's News Conference With European Union Leaders in Lisbon","https://www.presidency.ucsb.edu/documents/the-presidents-news-conference-with-european-union-leaders-lisbon","USA","Chechnya"
"Bill Clinton","June 01, 2000","Press Briefing by National Security Advisor Sandy Berger","https://www.presidency.ucsb.edu/documents/press-briefing-national-security-advisor-sandy-berger-3","USA","Chechnya"
"Bill Clinton","June 02, 2000","Remarks on Receiving the International Charlemagne Prize in Aachen, Germany","https://www.presidency.ucsb.edu/documents/remarks-receiving-the-international-charlemagne-prize-aachen-germany","USA","Chechnya"
"Bill Clinton","June 04, 2000","Interview With Aleksei Venediktov of Ekho Moskvy Radio in Moscow","https://www.presidency.ucsb.edu/documents/interview-with-aleksei-venediktov-ekho-moskvy-radio-moscow","USA","Chechnya"
"Bill Clinton","June 04, 2000","Press Briefing by Deputy Secretary of State Strobe Talbott","https://www.presidency.ucsb.edu/documents/press-briefing-deputy-secretary-state-strobe-talbott","USA","Chechnya"
"Bill Clinton","June 04, 2000","The President's News Conference With President Vladimir Putin of Russia in Moscow","https://www.presidency.ucsb.edu/documents/the-presidents-news-conference-with-president-vladimir-putin-russia-moscow","USA","Chechnya"
"Bill Clinton","June 05, 2000","Remarks to the Russian State Duma in Moscow","https://www.presidency.ucsb.edu/documents/remarks-the-russian-state-duma-moscow","USA","Chechnya"
"Bill Clinton","June 26, 2000","Statement of Administration Policy: S. 2522 - Foreign Operations, Export Financing, and Related Programs Appropriations Bill, FY 2001","https://www.presidency.ucsb.edu/documents/statement-administration-policy-s-2522-foreign-operations-export-financing-and-related","USA","Chechnya"
"Bill Clinton","July 11, 2000","Statement of Administration Policy: H.R. 4811 - Foreign Operations, Export Financing, and Related Programs Appropriations Bill, FY 2001","https://www.presidency.ucsb.edu/documents/statement-administration-policy-hr-4811-foreign-operations-export-financing-and-related","USA","Chechnya"
"Bill Clinton","July 12, 2000","Statement of Administration Policy: H.R. 4811 - Foreign Operations, Export Financing, and Related Programs Appropriations Bill, FY 2001","https://www.presidency.ucsb.edu/documents/statement-administration-policy-hr-4811-foreign-operations-export-financing-and-related-0","USA","Chechnya"
"Bill Clinton","July 17, 2000","Press Briefing by Lael Brainard, Deputy National Economic Advisor and Jim Steinberg, Deputy National Security Advisor","https://www.presidency.ucsb.edu/documents/press-briefing-lael-brainard-deputy-national-economic-advisor-and-jim-steinberg-deputy","USA","Chechnya"
"Bill Clinton","December 06, 2000","Remarks on Presenting the Eleanor Roosevelt Award for Human Rights and the Presidential Medal of Freedom","https://www.presidency.ucsb.edu/documents/remarks-presenting-the-eleanor-roosevelt-award-for-human-rights-and-the-presidential-medal","USA","Chechnya"
"Bill Clinton","December 08, 2000","Remarks at the University of Nebraska at Kearney, Nebraska","https://www.presidency.ucsb.edu/documents/remarks-the-university-nebraska-kearney-nebraska","USA","Chechnya"
"George W. Bush","June 06, 2001","Press Briefing by National Security Advisor Condoleezza Rice on President's Travel to Europe","https://www.presidency.ucsb.edu/documents/press-briefing-national-security-advisor-condoleezza-rice-presidents-travel-europe","USA","Chechnya"
"George W. Bush","June 14, 2001","Göteborg Statement: Summit of the United States of America and the European Union","https://www.presidency.ucsb.edu/documents/goteborg-statement-summit-the-united-states-america-and-the-european-union","USA","Chechnya"
"George W. Bush","June 16, 2001","Press Briefing by Secretary of State Colin Powell and National Security Advisor Condoleezza Rice","https://www.presidency.ucsb.edu/documents/press-briefing-secretary-state-colin-powell-and-national-security-advisor-condoleezza-rice","USA","Chechnya"
"George W. Bush","June 16, 2001","The President's News Conference With President Vladimir Putin of Russia in Kranj","https://www.presidency.ucsb.edu/documents/the-presidents-news-conference-with-president-vladimir-putin-russia-kranj","USA","Chechnya"
"George W. Bush","July 22, 2001","Press Briefing by Dr. Rice Discussing the Bilateral Meeting of President Bush and Russian President Putin in Genoa, Italy","https://www.presidency.ucsb.edu/documents/press-briefing-dr-rice-discussing-the-bilateral-meeting-president-bush-and-russian","USA","Chechnya"
"George W. Bush","September 25, 2001","Press Briefing by Ari Fleischer","https://www.presidency.ucsb.edu/documents/press-briefing-ari-fleischer-58","USA","Chechnya"
"George W. Bush","September 26, 2001","Press Briefing by Ari Fleischer","https://www.presidency.ucsb.edu/documents/press-briefing-ari-fleischer-57","USA","Chechnya"
"George W. Bush","September 26, 2001","Remarks Prior to Discussions With Muslim Community Leaders and an Exchange With Reporters","https://www.presidency.ucsb.edu/documents/remarks-prior-discussions-with-muslim-community-leaders-and-exchange-with-reporters","USA","Chechnya"
"George W. Bush","October 09, 2001","Remarks Following Discussions With Chancellor Gerhard Schroeder of Germany and an Exchange With Reporters","https://www.presidency.ucsb.edu/documents/remarks-following-discussions-with-chancellor-gerhard-schroeder-germany-and-exchange-2","USA","Chechnya"
"George W. Bush","October 15, 2001","Press Briefing by National Security Advisor Condoleezza Rice, on the APEC Meeting","https://www.presidency.ucsb.edu/documents/press-briefing-national-security-advisor-condoleezza-rice-the-apec-meeting","USA","Chechnya"
"George W. Bush","November 13, 2001","The President's News Conference With President Vladimir Putin of Russia","https://www.presidency.ucsb.edu/documents/the-presidents-news-conference-with-president-vladimir-putin-russia-0","USA","Chechnya"
"George W. Bush","February 01, 2002","Remarks by the National Security Advisor Condoleezza Rice to the Conservative Political Action Conference","https://www.presidency.ucsb.edu/documents/remarks-the-national-security-advisor-condoleezza-rice-the-conservative-political-action","USA","Chechnya"
"George W. Bush","February 28, 2002","Press Briefing by Ari Fleischer","https://www.presidency.ucsb.edu/documents/press-briefing-ari-fleischer-197","USA","Chechnya"
"George W. Bush","May 07, 2002","Press Briefing by Ari Fleischer","https://www.presidency.ucsb.edu/documents/press-briefing-ari-fleischer-246","USA","Chechnya"
"George W. Bush","May 24, 2002","Remarks to Community and Religious Leaders in Moscow","https://www.presidency.ucsb.edu/documents/remarks-community-and-religious-leaders-moscow","USA","Chechnya"
"George W. Bush","May 24, 2002","The President's News Conference With President Vladimir V. Putin of Russia in Moscow","https://www.presidency.ucsb.edu/documents/the-presidents-news-conference-with-president-vladimir-v-putin-russia-moscow","USA","Chechnya"
"George W. Bush","May 28, 2002","Press Briefing by Secretary of State Colin Powell","https://www.presidency.ucsb.edu/documents/press-briefing-secretary-state-colin-powell-0","USA","Chechnya"
"George W. Bush","July 12, 2002","Interview With Polish Journalists","https://www.presidency.ucsb.edu/documents/interview-with-polish-journalists-0","USA","Chechnya"
"George W. Bush","August 24, 2002","Statement by the Press Secretary","https://www.presidency.ucsb.edu/documents/statement-the-press-secretary-257","USA","Chechnya"
"George W. Bush","October 29, 2002","Press Briefing by Ari Fleischer","https://www.presidency.ucsb.edu/documents/press-briefing-ari-fleischer-145","USA","Chechnya"
"George W. Bush","November 13, 2002","Press Briefing by Scott McClellan","https://www.presidency.ucsb.edu/documents/press-briefing-scott-mcclellan-2","USA","Chechnya"
"George W. Bush","November 15, 2002","Press Briefing by Dr. Rice on the President's Trip to the NATO Summit","https://www.presidency.ucsb.edu/documents/press-briefing-dr-rice-the-presidents-trip-the-nato-summit","USA","Chechnya"
"George W. Bush","November 18, 2002","Interview With Radio Free Europe/Radio Liberty","https://www.presidency.ucsb.edu/documents/interview-with-radio-free-europeradio-liberty","USA","Chechnya"
"George W. Bush","November 18, 2002","Interview With LNK TV of Lithuania","https://www.presidency.ucsb.edu/documents/interview-with-lnk-tv-lithuania","USA","Chechnya"
"George W. Bush","November 18, 2002","Interview With European Journalists","https://www.presidency.ucsb.edu/documents/interview-with-european-journalists","USA","Chechnya"
"Madeleine Albright","20010203","12/10/99 Albright interview on CBS's ""The Early Show""","https://web.archive.org/web/20010203173100/https://1997-2001.state.gov/statements/1999/991210b.html","USA","Chechnya"
"Madeleine Albright","20010203","12/17/99 Albright press remarks following G-8 Foreign Ministers Meeting","https://web.archive.org/web/20010203173300/https://1997-2001.state.gov/statements/1999/991217b.html","USA","Chechnya"
"Madeleine Albright","20010121","2/8/00 Albright interview on CNN","https://web.archive.org/web/20010121100800/https://1997-2001.state.gov/statements/2000/000208b.html","USA","Chechnya"
"Madeleine Albright","20010407","2/2/00 Albright remarks following meeting with Min. Putin","https://web.archive.org/web/20010407153633/https://1997-2001.state.gov/statements/2000/000202a.html","USA","Chechnya"
"Madeleine Albright","20010407","3/26/00 Albright on CNN's ""Late Edition""","https://web.archive.org/web/20010407153856/https://1997-2001.state.gov/statements/2000/000326a.html","USA","Chechnya"
"Madeleine Albright","20010407","11/22/99 Albright interview on STV, Bratislava, Slovakia","https://web.archive.org/web/20010407153444/https://1997-2001.state.gov/statements/1999/991122d.html","USA","Chechnya"
"Madeleine Albright","20010407","10/26/99 Albright and Minister Van Aartsen remarks","https://web.archive.org/web/20010407153533/https://1997-2001.state.gov/statements/1999/991026.html","USA","Chechnya"
"Madeleine Albright","20010407","1/2/2000: Albright on NBC's ""Meet The Press""","https://web.archive.org/web/20010407153234/https://1997-2001.state.gov/statements/2000/000102.html","USA","Chechnya"
"Madeleine Albright","20010407","12/12/99 Albright interview on Face the Nation","https://web.archive.org/web/20010407153216/https://1997-2001.state.gov/statements/1999/991212.html","USA","Chechnya"
"Colin Powell","20030501","Interview With Russian Television NTV","https://web.archive.org/web/20030501010101/https://2001-2009.state.gov/secretary/former/powell/remarks/2003/20665.htm","USA","Chechnya"
"Colin Powell","20030601","Interview with Barry Schweid and George Gedda of Associated Press","https://web.archive.org/web/20030601104120/https://2001-2009.state.gov/secretary/former/powell/remarks/36076.htm","USA","Chechnya"
"Colin Powell","20020126","Interview on TV6","https://web.archive.org/web/20020126092813/https://2001-2009.state.gov/secretary/former/powell/remarks/2001/dec/6750.htm","USA","Chechnya"
"Colin Powell","20030501","Press Conference with Russian Foreign Minister Igor Ivanov","https://web.archive.org/web/20030501010305/https://2001-2009.state.gov/secretary/former/powell/remarks/2003/20571.htm","USA","Chechnya"
"Colin Powell","20030709","Remarks to the United Nations Security Council","https://web.archive.org/web/20030709102408/https://2001-2009.state.gov/secretary/former/powell/remarks/2003/17300.htm","USA","Chechnya"
"Colin Powell","20030821","Interview With Vladimir Varfalomeyev at Ekho Moskvy Radio","https://web.archive.org/web/20030821054856/https://2001-2009.state.gov/secretary/former/powell/remarks/28522.htm","USA","Chechnya"
"Colin Powell","20030620","U.S. Policy on Chechnya","https://web.archive.org/web/20030620041742/https://2001-2009.state.gov/p/eur/rls/rm/2002/10034.htm","USA","Chechnya"
"Colin Powell","20020926","Press Briefing Aboard Aircraft En Route To Shanghai","https://web.archive.org/web/20020926023852/https://2001-2009.state.gov/secretary/former/powell/remarks/2001/5427.htm","USA","Chechnya"
"Colin Powell","20030709","A Strategy of Partnerships","https://web.archive.org/web/20030709101427/https://2001-2009.state.gov/secretary/former/powell/remarks/28163.htm","USA","Chechnya"
"Colin Powell","20031203","Terrorist Designation Under Executive Order 13224","https://web.archive.org/web/20031203005312/https://2001-2009.state.gov/r/pa/prs/ps/2003/18067.htm","USA","Chechnya"
"Colin Powell","20030709","Partnership, Under Construction","https://web.archive.org/web/20030709101847/https://2001-2009.state.gov/secretary/former/powell/remarks/28495.htm","USA","Chechnya"
"Colin Powell","20030709","Secretary of State Colin L. Powell And The Honorable Alphonso Jackson, Secretary of Housing and Urban Development and Head of U.S. Delegation to OSCE Conference on Racism, Xenophobia and Discrimination After Their Meeting","https://web.archive.org/web/20030709093723/https://2001-2009.state.gov/secretary/former/powell/remarks/35982.htm","USA","Chechnya"
"Colin Powell","20020822","Remarks with Russian Foreign Minister Igor Ivanov (1350 hrs)","https://web.archive.org/web/20020822105245/https://2001-2009.state.gov/secretary/former/powell/remarks/2001/4962.htm","USA","Chechnya"
"Colin Powell","20030821","Remarks at The Elliott School of International Affairs","https://web.archive.org/web/20030821055119/https://2001-2009.state.gov/secretary/former/powell/remarks/2003/23836.htm","USA","Chechnya"
"Putin","2000-03-20","Владимир Путин принял участие в церемонии вывода из Чечни парашютно-десантного полка","https://web.archive.org/web/20000321000000/https://kremlin.ru/events/president/news/38776","Russia","Chechnya"
"Putin","2000-03-20","Владимир Путин прибыл в Грозный","https://web.archive.org/web/20000321010000/https://kremlin.ru/events/president/news/38841","Russia","Chechnya"
"Putin","2001-10-08","Вступительное слово на совещании с членами Правительства","https://web.archive.org/web/20000401000000/https://kremlin.ru/events/president/transcripts/21355","Russia","Chechnya"
"Putin","2000-07-05","Владимир Путин провел комплексное совещание по вопросам правоохранительного, политического и экономического урегулирования в Чеченской Республике","https://web.archive.org/web/20000706000000/https://kremlin.ru/events/president/news/38339","Russia","Chechnya"
"Putin","2001-12-17","Владимир Путин вручил награды членам чеченской семьи Ташухаджиевых за героизм, проявленный в схватке с преступниками","https://web.archive.org/web/20020401000000/https://kremlin.ru/events/president/news/41988","Russia","Chechnya"
"Putin","2000-01-15","Интервью телеканалу ОРТ","https://web.archive.org/web/20000105000000/https://kremlin.ru/events/president/transcripts/24123","Russia","Chechnya"
